"job_title","job_skill","job_company","job_location","job_salary"
"Data Scientist","SQL, Predictive Analytics, Hive, Natural Language Processing, AWS","United Network for Organ Sharing","Richmond, VA","$86k-$110k"
"Junior Data Scientist","SQL, R, Communication Skills, Relational Databases, Software Development","Numero Data LLC","Herndon, VA",NA
"Data Scientist - Full Time","401(k), IAT, SAS, IAT Level II, Python","TekSynap","Richmond, VA","$96k-$130k"
"SR. DATA SCIENTIST","SQL, Git, Hadoop, Hive, Google Cloud Platform","Foot Locker, Inc.","New York, NY","$110k-$150k"
"Data Scientist","SQL, AWS, TensorFlow, Internet Of Things, Math","SharkNinja","Needham, MA","$100k-$140k"
"Data Scientist","SQL, Tableau, Git, Natural Language Processing, Apache","CGI Group, Inc.","Baltimore, MD","$90k-$120k"
"NLP Data Scientist","SQL, NoSQL, Tableau, Git, Data Mining","Radiology Partners","Columbus, OH","$86k-$120k"
"Scientist III/IV, BioProcess Science - Contract","Laboratory Experience, Statistical Software, Troubleshooting","Boehringer Ingelheim","Athens, GA","$77k-$100k"
"Senior Data Scientist","Scalability, Hadoop, TensorFlow, Spark, Cassandra","TeleSense, Inc.","Sunnyvale, CA","$100k-$150k"
"Data Scientist","SQL, Tableau, Business Intelligence, Data Structures, R","Ancore","Franklin, TN","$82k-$120k"
"Senior Data Scientist - Disney +","SQL, Tableau, Communication Skills, Data Modeling, Predictive Analytics","Disney Streaming Services","Glendale, CA","$87k-$120k"
"SCIENTIST","401(k), GLP, High-Performance Liquid Chromatography, Communication Skills","Fresenius Kabi","Wilson, NC","$50k-$69k"
"Scientist / Team Lead, Protein Degradation - Medicinal Chemistry","Communication Skills","Kronos Bio","Cambridge, MA","$86k-$110k"
"Water Resources Engineer","R, GIS, Python","Lynker Technologies","Tuscaloosa, AL","$83k-$110k"
"Full Stack Developer","SQL, NoSQL, PostgreSQL, 401(k), Microservices","Anvilogic","Palo Alto, CA","$120k-$160k"
"Liquidity Data Scientist","SQL, Tableau, Business Intelligence, SAS, Communication Skills","GTN Technical Staffing","Tempe, AZ",NA
"Lead Data Scientist - elovee","Natural Language Processing, TensorFlow, AWS, Azure, Team Management","BCGDV","New York, NY","$110k-$150k"
"Associate Data Scientist","SQL, Tableau, Relational Databases, Hadoop, Hive","Macy's","New York, NY","$79k-$110k"
"Data Scientist","SQL, Natural Language Processing, Hadoop, Facilities Management, Asset Management","Dude Solutions, Inc.","Cary, NC","$98k-$130k"
"Associate Data Scientist","Data Management, SQL, Tableau, Requirements Gathering, Leadership Experience","Optimal Solutions Group","College Park, MD","$95k-$130k"
"Data Scientist","Tableau, Predictive Analytics, Natural Language Processing, Oracle, Citrix","Frontier Technology Inc.","Norfolk, VA","$100k-$140k"
"Data Scientist","SQL, 401(k), Hadoop, AWS, Spark","Retina AI","Santa Monica, CA","$100k-$140k"
"Data Scientist","SQL, NoSQL, Hive, Scripting, Elasticsearch","Shareablee","New York, NY","$110k-$150k"
"Data Scientist","Software Development, Hadoop, Apache, DoD 8570, Spark","Varen Technologies","Reston, VA","$100k-$150k"
"Data Scientist","SQL, User Research, SAS, R, Communication Skills","Oxide Games","Timonium, MD","$91k-$130k"
"Data Scientist","SQL, Tableau, Software Development, HTML5, SDLC","West Virginia University Hospital","Morgantown, WV","$86k-$110k"
"Data Scientist","SQL, Financial Services, Hadoop, SAS, R","Paypal","San Jose, CA","$100k-$140k"
"Clinical Lab Technologist-Blood Bank-Fridays, Saturdays, Sundays","Quality Assurance, Communication Skills","NYU Langone Health","New York, NY","$58k-$82k"
"Lead Data Scientist","SQL, Git, Natural Language Processing, Google Cloud Platform, AWS","Capsule","New York, NY","$95k-$120k"
"Wetland Scientist/Ecologist","Technical Writing, Microsoft Word, Driver's License, AutoCAD, Microsoft Office","Wetlands & Wildlife, Inc.","Woodinville, WA","$64k-$86k"
"Senior Technical Product Manager","SQL, Analytics, Analysis Skills, Machine Learning","Wayfair","Boston, MA","$94k-$120k"
"Data Scientist – Applied Research","NoSQL, Technical Writing, Software Development, Hadoop, AWS","MITRE","Bedford, MA","$96k-$130k"
"Sr. Associate, Data Scientist, NLP","SQL, Multithreading, Git, Natural Language Processing, Google Cloud Platform","KPMG","Atlanta, GA","$110k-$140k"
"Mechanical Engineering Technologist","401(k), Mechanical Design, Mechanical Engineering Experience, GD&T, SolidWorks","Spectral Sensor Solutions, LLC.","Albuquerque, NM","$69k-$92k"
"Data Scientist","SQL, Tableau, Hadoop, TensorFlow, Spark","KEYW Corporation","Herndon, VA","$110k-$160k"
"Data Scientist Technical Lead","SQL, Management Experience, Data Structures, Leadership Experience, R","Google","New York, NY","$94k-$120k"
"Data Scientist","SQL, 401(k), Hadoop, AWS, Spark","Synchronoss","Reston, VA","$120k-$150k"
"Data Scientist","SQL, Hadoop, Hive, Pig, Spark","InfoQuest Consulting Group Inc.","Monmouth Junction, NJ","$110k-$150k"
"Data Scientist","Java, R, C/C++, Python","Systems Plus","Tampa, FL","$130k-$170k"
"Data Scientist","NoSQL, Relational Databases, Linux, UI, Python","Brookhaven National Laboratory","Upton, NY","$84k-$120k"
"Data Scientist","Public Speaking, SDLC, Data Structures, SAS, Word Processing","N C Q A","Washington, DC","$100k-$140k"
"Data Scientist","SQL, Time Management, OBIEE, Business Intelligence, PL/SQL","FEDDATA","Washington, DC","$85k-$120k"
"Data Scientist 6","SQL, Hadoop, Predictive Analytics, Project Management, SAS","U.S. Bank","Portland, OR","$82k-$110k"
"Data Scientist (CI 001/DBE3)","SQL, PostgreSQL, GitHub, CI, TensorFlow","Scientific Systems and Software International (SSSI)","Baltimore, MD","$97k-$140k"
"Data Analyst-Statistical-Stf","SQL, Analysis Skills, SAS, Word Processing, R","Intermountain Healthcare","Salt Lake City, UT","$64k-$82k"
"Scientist, Protein Biochemistry","401(k)","Fornia BioSolutions, Inc.","Hayward, CA","$71k-$92k"
"Data Scientist, Peacock, Direct-to-Consumer","SQL, Google Cloud Platform, Spark, R, Java","NBCUniversal","New York, NY","$100k-$140k"
"Pharmacovigilance Scientist Consultant","SharePoint, Clinical Trials, BC/BE, Analysis Skills, Microsoft Office","SAGE Therapeutics","Cambridge, MA","$98k-$140k"
"Sr Strategic Consultant / Data Scientist (Patient Access)","SQL, Tableau, Relational Databases, R, Analytics","Memorial Sloan Kettering","New York, NY","$120k-$160k"
"Data Scientist","AI, Machine Learning","Clarigent Health","Mason, OH",NA
"Senior Environmental Scientist- Remediation Specialist","Technical Writing, 401(k), ArcGIS, Communication Skills, Office Experience","The Thrasher Group Inc.","Bridgeport, WV","$68k-$92k"
"Manager, Data & Analytics Modeler, Machine Learning","SQL, Tableau, Software Development, Hadoop, Spark","KPMG","Atlanta, GA","$90k-$120k"
"Civil Engineering Designer - Dublin or Newark OH","Drafting, Communication Skills, MicroStation, Illustration, Organizational Skills","Hull & Associates Inc","Newark, OH","$60k-$78k"
"Data Scientist","SQL, Tableau, Hadoop, Spark, SAS","Snapiotech.","Cumming, GA","$99k-$130k"
"Data Scientist","Image Processing, Presentation Skills, Computer Vision, Analytics, TensorFlow","Grid Dynamics","Atlanta, GA","$130k-$180k"
"Brand Analytics Data Scientist","SQL, R, Communication Skills, Presentation Skills, Analytics","Alyvant","New York, NY","$92k-$120k"
"Data Scientist","SQL, Time Management, Project Management, C#, Analysis Skills","Aramark","Philadelphia, PA","$77k-$100k"
"Data Scientist","SQL, Tableau, Software Development, Predictive Analytics, Power BI","U.S. Xpress Enterprises, Inc.","Chattanooga, TN","$96k-$120k"
"Computer Scientist (Data Scientist)","Teaching Experience, Calculus, System Design, AI, Machine Learning","Centers for Disease Control and Prevention","Atlanta, GA",NA
"Staff Data Scientist","Data Mining, Analytics, Machine Learning","TriMedx","Indianapolis, IN","$97k-$130k"
"Scientist/Data Analyst","R, SPSS, Grant Writing, Microsoft Access, SAS","Billings Clinic","Billings, MT","$75k-$100k"
"Data Scientist","SQL, NoSQL, Data Management, Tableau, Hadoop","Zimmerman Advertising","Fort Lauderdale, FL","$78k-$110k"
"Data Scientist","SQL, R, Communication Skills, Hive, Scala","Roku","Santa Monica, CA","$100k-$150k"
"Registered Nurse - Plum Island","Communication Skills, EMR Systems, RN, Nursing Experience, Driver's License","Caliburn International","Orient, NY","$54k-$75k"
"Data Scientist (Python)","Python","Technical Recruiting Solutions","Lafayette, IN",NA
"Junior Data Scientist","SQL, Tableau, Natural Language Processing, Power BI, OOP","Logistics Management Institute","Tysons, VA","$89k-$120k"
"Data Engineer for ML/AI","401(k), Analytics, Big Data, AI, Machine Learning","Collins Aerospace","Cedar Rapids, IA","$95k-$130k"
"Software Engineer","PostgreSQL, NoSQL, MySQL, Django, Databases","Invitae","San Francisco, CA","$110k-$140k"
"Senior Data Scientist","Natural Language Processing, TensorFlow, Math, Clustering, R","BlueVine","Redwood City, CA","$82k-$110k"
"Applied Data Science Lead and Architect","SQL, PostgreSQL, Git, Hadoop, Hive","Humana","Boston, MA","$120k-$160k"
"Sr. Research Scientist I - In Vivo Pharmacology","Leadership Experience","Kite Pharma","Santa Monica, CA","$97k-$140k"
"Associate Optical Engineer/Scientist","Visual Basic, MATLAB","BOEING","Seal Beach, CA","$74k-$100k"
"Data Scientist","Hadoop, AWS, NIST Standards, Spark, FISMA","Prescient Edge Federal","Springfield, VA","$100k-$130k"
"Data Scientist","SQL, Hadoop, Elasticsearch, Spark, MySQL","Simon Data","New York, NY","$130k-$160k"
"Data Scientist","SQL, 401(k), Customer Segmentation, SAS, Data Analysis Skills","Colony Brands, Inc.","Monroe, WI","$80k-$110k"
"Data Scientist","SQL, NoSQL, Hadoop, AWS, Spark","BoxyCharm","Pembroke Pines, FL","$110k-$140k"
"Data Scientist Internship","SQL, Tableau, Hadoop, Hive, Linux","Equifax","Atlanta, GA","$80k-$100k"
"Data Scientist Lead","SQL, Tableau, Hadoop, Power BI, Azure","Navistar, Inc.","Lisle, IL","$120k-$150k"
"Data Scientist","Predictive Analytics, Big Data, Salt","MCR, LLC.","Norfolk, VA","$110k-$150k"
"Data Scientist Snr Manager","SQL, 401(k), Software Development, Cloud Architecture, Management Experience","Oracle","Broomfield, CO","$120k-$150k"
"Data Scientist","SQL, Hive, Spark, Analysis Skills, SAS","KnowBe4","Clearwater, FL","$91k-$110k"
"Data Scientist - Cross Asset Desk Strategist Team","Financial Services, Data Analysis Skills, Python","Morgan Stanley","New York, NY","$110k-$150k"
"Quantitative Analyst,Off","SQL, Financial Services, Project Management, SAS, Visual Basic","State Street","New York, NY","$140k-$190k"
"SENIOR SOFTWARE ENGINEER - Java/Python/Clojure (US Citizenship Req'd)","Performance Tuning, Git, AWS, Clojure, Maven","BigBear, Inc.","San Diego, CA","$110k-$140k"
"Data Scientist I - (Part-time)","MATLAB, Python, Math","Columbus Technologies and Services, Inc.","Pasadena, CA","$100k-$150k"
"Senior Chief Research Scientist","Data Mining","Perspecta","Chantilly, VA","$78k-$100k"
"Principal Food Scientist","Time Management, Organizational Skills, Food Safety Experience, Project Management, HARPC","SmithFoods","Orrville, OH","$52k-$71k"
"Senior Scientist, Molecular Biology","Microsoft Word, Excel, PCR, DNA Isolation, Microsoft Powerpoint","ANDE Corporation","Waltham, MA","$81k-$99k"
"Data Scientist","SQL, PostgreSQL, 401(k), Software Development, Natural Language Processing","NarrativeDx","Austin, TX","$92k-$130k"
"Senior Data Scientist - Advanced Analytics (763882)","SQL, R, Data Mining, Relational Databases, Marketing","Fortune 500 client of Nabler","Burbank, CA",NA
"Data Scientist","R, Communication Skills, Data Mining, Natural Language Processing, Regression Analysis","Stanza","San Francisco, CA","$100k-$140k"
"Data Scientist","SQL, Data Mining, Big Data, Data Science, Regression Analysis","Beyond Finance","Santa Fe, NM","$99k-$130k"
"Precision Medicine Data Scientist","SQL, XML, Tableau, 401(k), SFTP","Texas Oncology","Dallas, TX","$75k-$110k"
"Data Scientist","SQL, 401(k), Communication Skills, Regression Analysis, Python","National Debt Relief","New York, NY","$77k-$98k"
"Data Scientist","R, Communication Skills, Python, Math, Machine Learning","Invent Analytics","Philadelphia, PA","$110k-$160k"
"Data Scientist, Analytics & Inference","SQL, GitHub, Tableau, Business Intelligence, R","Codecademy","New York, NY","$98k-$130k"
"2020 Intern - Data Scientist Intern/Coop (EO&S)","Communication Skills, Java, Python, Agile, Machine Learning","IBM","Research Triangle Park, NC","$96k-$130k"
"Data Scientist, Engineer","SQL, NoSQL, R, Hadoop, Spark","ATI","Monroe, NC","$110k-$150k"
"JUNIOR DATA SCIENTIST","SQL, 401(k), Power BI, SAP, Visual Basic","Collins Aerospace","Rockford, IL","$76k-$100k"
"Data Scientist","SQL, 401(k), Hadoop, AWS, Spark","Datastrong","Washington, DC","$120k-$170k"
"Data Scientist","Git, Software Development, Hadoop, Spark, Databases","Capax Global LLC","Chicago, IL","$110k-$150k"
"Senior Data Scientist / Artificial Intelligence / Machine Learning / AI/ML Scientist","Time Management, SQL, NoSQL, TensorFlow, Apache","Vanguard","Malvern, PA","$170k-$230k"
"Data Scientist","SQL, Heavy Lifting, Experimental Design, Presentation Skills, Microsoft SQL Server","Transworld Systems, Inc.","Lake Forest, IL","$81k-$110k"
"Senior Data Engineer","SQL, NoSQL, PostgreSQL, Hadoop, AWS","Here Engineering","Boxborough, MA","$140k-$190k"
"Software Architect","Communication Skills, Software Development, AWS, Scala, Python","Event Dynamic","Dallas, TX","$110k-$140k"
"Principal Investigator-Lead Scientist I-Large Molecule","Communication Skills","Covance","Indianapolis, IN","$64k-$89k"
"Data Analyst","SQL, PostgreSQL, AJAX, MySQL, Oracle","Colgate-Palmolive","Piscataway, NJ","$64k-$84k"
"Associate Scientist/Scientist, In vivo pharmacology","Laboratory Experience, Laboratory Techniques","QLB Biotherapeutics, Inc.","Boston, MA","$65k-$87k"
"Discovery LC-MS Method Development Scientist","Communication Skills, Presentation Skills, Laboratory Experience","Covance","Madison, WI","$76k-$100k"
"Data Scientist- Portfolio Management & Provisioning","SQL, Communication Skills, Forecasting, Data Science, Regression Analysis","Credibly","New York, NY","$100k-$130k"
"Data Scientist I","Excel, Communication Skills, Tableau, R, SPSS","GovStrive LLC","Atlanta, GA","$72k-$96k"
"Data Scientist","R, MATLAB, AWS, Microsoft SQL Server, Linux","MIT","Cambridge, MA","$110k-$150k"
"Data Scientist","SQL, NoSQL, Software Development, Math, Databases","General Dynamics Mission Systems","Chantilly, VA","$98k-$130k"
"Data Scientist (Cambridge or RTP)","R, Communication Skills, Data Mining, MATLAB, Alteryx","Biogen","Cambridge, MA","$120k-$170k"
"Data Scientist, BitTorrent Speed","SQL, Tableau, 401(k), Hadoop, AWS","Tron","San Francisco, CA","$110k-$150k"
"Data Scientist, Optimization","SQL, PostgreSQL, AWS, Project Management, Data Structures","Revel","Brooklyn, NY","$91k-$130k"
"Programmer/Data Scientist (Researcher)","SQL, NoSQL, Hadoop, Natural Language Processing, Elasticsearch","New York University","New York, NY","$100k-$140k"
"NEE Data Analysis / Integration Engineer","LAN","Perspecta","Chantilly, VA","$66k-$93k"
"Microbiologist/Food Scientist (some evenings)","Microbiology","Katahdin Analytical Services","Portland, ME","$31k-$41k"
"Data Scientist Analyst","SQL, Tableau, Data Warehouse, Math, Microsoft Office","LOCKHEED MARTIN CORPORATION","Milwaukee, WI","$68k-$87k"
"Support Scientist - Ocean Data Assimilation - Marine DA","401(k), OOP, Communication Skills, Fortran, C/C++","IMSG/NOAA","College Park, MD","$78k-$110k"
"Data Scientist","401(k), Software Development, AWS, Spark, SDLC","FairWarning","Saint Petersburg, FL","$76k-$110k"
"Data Scientist","R, AWS, S3, AI, Python","The Denzel Group","Edison, NJ","$120k-$160k"
"Data Scientist","SQL, NoSQL, AWS, Data Mining, Regression Analysis","Aegis Premier Technologies","Westminster, CO","$92k-$130k"
"Analytics Engagement Manager","SQL, Tableau, Communication Skills, R, Analytics","Transamerica","Denver, CO","$75k-$110k"
"Data Scientist","SQL, Hadoop, Hive, Spark, Communication Skills","The Hartford","Hartford, CT",NA
"Data Scientist","SQL, Tableau, Relational Databases, HTML5, Analysis Skills","CORP Saint Luke's Health System, Inc.","Kansas City, MO","$92k-$120k"
"Data Scientist, Alexa Excellence","SQL, Math, SAS, R, Communication Skills","Amazon.com Services, Inc.","Seattle, WA","$120k-$150k"
"Associate Data Scientist (Full Time Starting Summer 2020)","SQL, 401(k), AWS, R, Python","EAB","Washington, DC","$95k-$130k"
"Data Scientist","R, Natural Language Processing, Hadoop, Hive, Big Data","Tiger Analytics","Chicago, IL","$110k-$140k"
"Data Scientist - Delphi","SQL, Presentation Skills, Hadoop, Hive, Analysis Skills","Amazon.com Services, Inc.","Seattle, WA","$95k-$130k"
"Data Scientist","SQL, Tableau, Git, Natural Language Processing, Apache","CGI Veterans Jobs","Baltimore, MD","$95k-$120k"
"Data Scientist - CI Poly","R, 401(k), Python","SixGen, Inc.","Hanover, MD",NA
"Data Scientist - Music","SQL, Presentation Skills, SAS, R, Communication Skills","Amazon.com Services, Inc.","Seattle, WA","$100k-$140k"
"Artificial Intelligence/Machine Learning Data Scientist","SQL, Tableau, Software Development, Management Experience, Hadoop","Ford Motor Company","Dearborn, MI","$96k-$130k"
"Data Scientist","R, Communication Skills, MATLAB, Python, Perl","United Technologies Corp. Headquarters","Brooklyn, NY","$110k-$160k"
"Data Scientist w/Polygraph","SQL, Tableau, Continuous Improvement, SAS, Data Mining","Leidos","McLean, VA","$88k-$130k"
"UX Designer- New York, NY or Bloomfield, CT","XML, Adobe XD, HTML5, Sketch, Program Development","CGI Group, Inc.","Bloomfield, CT","$89k-$120k"
"Data Scientist / Data Analytics Manager","SQL, R, Data Warehouse, Python, Machine Learning","Zola","New York, NY","$100k-$140k"
"Lead Data Scientist IV, Central Analytics","Analytics, Docker, AI, Python, Machine Learning","Zynga","Austin, TX","$84k-$120k"
"FULL STACK SOFTWARE DEVELOPER - Python/Django","401(k), Software Development, AWS, Elasticsearch, SDLC","BigBear, Inc.","Reston, VA","$82k-$120k"
"Medical Science Liaison, Southern California","Presentation Skills, Clinical Trials, Clinical Research, Analysis Skills, Communication Skills","Pharmacyclics, an Abbvie Company","Los Angeles, CA","$64k-$88k"
"Director, Data Scientist, Natural Language Processing","SQL, Multithreading, Git, Natural Language Processing, Google Cloud Platform","KPMG","New York, NY","$130k-$160k"
"VP of Product Development","Analysis Skills, Communication Skills, Business Management","Crop One Holdings, Inc.","San Francisco Bay Area, CA","$83k-$120k"
"Research Scientist, Translational Medicine","Genetics, Laboratory Experience, Clinical Trials, Analysis Skills, Communication Skills","Kite Pharma","Santa Monica, CA","$89k-$120k"
"Data Scientist","SQL, Relational Databases, Software Development, AWS, Analysis Skills","Cadent","Philadelphia, PA","$100k-$150k"
"Distinguished Data Scientist","SQL, Natural Language Processing, Spark, Linux, Communication Skills","Verizon","New York, NY","$120k-$160k"
"Data Scientist","Data Mining, Big Data, Data Science, Machine Learning","Covenant Eyes","Owosso, MI","$93k-$120k"
"Data Scientist","Tableau, Power BI, Ellucian, Business Intelligence, Excel","Mercer University","Macon, GA","$63k-$85k"
"Staff Data Scientist","Relational Databases, Scripting, AWS, Linux, Go","RocketCyber","United States","$99k-$140k"
"Data Scientist","SQL, Predictive Analytics, R, Communication Skills, Python","Elder Research Inc","Charlottesville, VA","$96k-$130k"
"Data Scientist","SQL, Hadoop, Microsoft Word, Microsoft Access, Microsoft Office","Domtar","Raleigh, NC","$80k-$110k"
"Data Scientist","SQL, Tableau, 401(k), Power BI, Spark","PrecisionLender","Charlotte, NC","$90k-$120k"
"Chief Data Scientist","Presentation Skills, Cloud Architecture, Natural Language Processing, Leadership Experience, Data Mining","Booz Allen Hamilton","Washington, DC","$120k-$170k"
"Environmental Sample and Data Analysis Support","Data Collection, Microsoft Word, Math, Heavy Lifting, Excel","","Ada, OK",NA
"Lead Data Scientist - A/B Testing Methodology","SQL, Hadoop, Hive, Spark, R","TARGET","Sunnyvale, CA","$83k-$110k"
"Associate, Data Scientist, NLP, Financial Services","SQL, Multithreading, Git, AWS, Elasticsearch","KPMG","Charlotte, NC","$96k-$130k"
"Data Scientist","SQL, Driving Experience, Tableau, 401(k), SAS","Vanda Pharmaceuticals Inc.","Washington, DC","$110k-$140k"
"Analysis Technician","Communication Skills","New England Peptide, Inc","Gardner, MA",NA
"Genomics Scientist","Analysis Skills, Communication Skills, Organizational Skills, Molecular Biology","The Jackson Laboratory","Bar Harbor, ME","$83k-$120k"
"Research Scientist - Protein Biochemistry","Time Management, Drug Discovery, Communication Skills","X-Chem Pharmaceuticals","Waltham, MA","$67k-$86k"
"ELISA Development Scientist","Communication Skills, Organizational Skills, Immunoassays, ELISA","Evergreen Sciences, Inc.","Bothell, WA","$72k-$94k"
"Scientist, NMR/Structural Biology","Communication Skills, Drug Discovery, Spectroscopy","Plexxikon","Berkeley, CA","$69k-$95k"
"Sr. Product Development Scientist - R&D","Organizational Skills, FDA Regulations","UniWell Laboratories, LLC","Fort Worth, TX","$66k-$87k"
"Data Engineer","SQL, NoSQL, Hadoop, AWS, Spark","Hospital for Special Surgery","New York, NY","$120k-$160k"
"Data Scientist","GitHub, Tableau, Hadoop, Power BI, AWS","Customer Value Partners","Fairfax, VA","$100k-$130k"
"Data Scientist","R, Communication Skills, Data Mining, Hadoop, SPSS","Centare","Milwaukee, WI","$93k-$130k"
"Data Scientist","R, Data Mining, Analytics, Python, Machine Learning","Parkview Health","Fort Wayne, IN","$110k-$140k"
"Data Scientist","R, Python, Machine Learning","Cyient","Pittsburgh, PA","$100k-$140k"
"Data Scientist/Data Analyst","Manufacturing Experience, Analysis Skills","Plexus Scientific Corporation","Washington, DC",NA
"Data Scientist (PhD Required)","SQL, 401(k), Regression Analysis, Python, Machine Learning","Madison Logic","New York, NY","$120k-$150k"
"Quantitative Data Scientist","Data Mining","University of Utah","Salt Lake City, UT",NA
"Data Scientist","Visual Basic, SQL, R, Data Mining, Python","Jo-Ann Fabric and Craft Stores","Hudson, OH","$87k-$120k"
"Data Scientist - Schmidt DataX Project","SQL, Data Analysis Skills, Database Design, IT Experience, Python","Princeton University","Princeton, NJ","$90k-$120k"
"RF/SATCOM Engineer (TS/SCI)","Data Analysis Skills, Signal Processing, Military Experience, CompTIA Security+, Troubleshooting","Cosmic Advanced Engineered Solutions","Colorado Springs, CO",NA
"Senior Software Engineer, Software Infrastructure - Autonomous Driving","Docker, Linux, C/C++, Python","Aptiv","Boston, MA","$110k-$150k"
"Data Scientist","401(k), Databases, R, Regression Analysis, Statistical Analysis","TechnologyAdvice","Nashville, TN","$100k-$150k"
"INSTITUTE ASSOCIATE SCIENTIST III - TRANSLATIONAL BIOLOGY","Experimental Design","MD Anderson Cancer Center","Houston, TX","$73k-$97k"
"Senior Scientist, Bioinformatics","PostgreSQL, SQL, Relational Databases, Git, Scripting","BD","San Jose, CA","$85k-$120k"
"Lead Data Scientist, Words with Friends","SQL, Tableau, Hadoop, QlikView, Spark","Zynga","San Francisco, CA","$87k-$110k"
"Data Scientist","SQL, Tableau, R, Python, Pricing","Universal Orlando","Orlando, FL","$78k-$100k"
"Quantitative Analyst","Communication Skills, Software Development, Survival Analysis, Regression Analysis, Bloomberg","Bloomberg","New York, NY","$130k-$190k"
"Scientist/Senior Scientist, Analytical Development - Small Molecules","Time Management, Technical Writing, 401(k), Analysis Skills, Manufacturing Experience","Takeda Pharmaceuticals","Boston, MA","$76k-$100k"
"Data Scientist, Boston","AI, Machine Learning","Spacemaker","Boston, MA","$110k-$130k"
"Data Scientist, New Graduate (2020)","SQL, R, Communication Skills, Java, Hadoop","Duolingo","Pittsburgh, PA","$100k-$130k"
"Quantitative/Data Analyst Intern","SQL, R, Forecasting, MySQL, Python","KKI Capital","New York, NY","$91k-$130k"
"Data Scientist","SQL, Hadoop, Hive, Power BI, Spark","BUSINESS INTEGRA, INC","Santa Clara, CA",NA
"Staff Data Scientist","Data Management, SAS, Data Mining, Data Modeling, Analytics","GE Power","Atlanta, GA","$110k-$130k"
"Data Scientist","Data Mining, Marketing Automation, Data Science, Regression Analysis, Machine Learning","Klaviyo","Boston, MA","$93k-$120k"
"Sr. Data Scientist","SQL, Git, Survival Analysis, R, Google Analytics","IXIS Digital","Burlington, VT","$91k-$130k"
"Senior Data Scientist","Tableau, Public Speaking, Relational Databases, Presentation Skills, System Design","sparks & honey","New York, NY","$120k-$160k"
"Data Scientist","SQL, R, Java, 401(k), Predictive Analytics","Enable Data","Minneapolis, MN","$100k-$130k"
"Agricultural Innovation Engineer","Mechanical Knowledge","Rodale Institute","Kutztown, PA","$69k-$91k"
"Associate, Data & Analytics Modeler Machine Learning - FS","SQL, Tableau, Software Development, Hadoop, Spark","KPMG","Washington, DC","$75k-$95k"
"Data Scientist (Consumer Credit Risk)","Excel, Visual Basic, SQL, R, Stata","QuadPay","New York, NY","$120k-$150k"
"Data Scientist - Team Lead","SQL, R, Data Mining, Analytics, Python","Inspire Brands","Atlanta, GA","$94k-$130k"
"Scientist - Commercial Quality Control - HPLC - Dissolution - GMP","Excel, Time Management, Quality Management, Technical Writing, Communication Skills","PPD","Boston, MA","$74k-$98k"
"Comercial Customer Engagement Strategy Specialist","Communication Skills, Marketing, Management Consulting, Analytics, Digital Marketing","Lenox Executive Search","Boston, MA","$80k-$120k"
